{"archive_validation":"verified","directories":1,"entries":3,"executable_not_manifest_entry_point_paths":[],"executable_paths":["plugin/main.sh"],"files":[{"manifest_entry_point":false,"mode":420,"path":"manifest.json","sha256":"a1a1a1a1a1a1a1a1a1a1a1a1a1a1a1a1a1a1a1a1a1a1a1a1a1a1a1a1a1a1a1a1","size":5},{"manifest_entry_point":true,"mode":493,"path":"plugin/main.sh","sha256":"a2a2a2a2a2a2a2a2a2a2a2a2a2a2a2a2a2a2a2a2a2a2a2a2a2a2a2a2a2a2a2a2","size":10}],"hidden_executable_paths":[],"links":0,"manifest_entry_point_paths":["plugin/main.sh"],"omarchy_manifest_validation":"passed","regular_files":2,"schema":"urn:a-quo:omarchy-plugin-structural-evidence:v1","special_entries":0,"subject":{"analysis_stream_schema":"a-quo-regular-file-stream-v1","analysis_stream_sha256":"a9a9a9a9a9a9a9a9a9a9a9a9a9a9a9a9a9a9a9a9a9a9a9a9a9a9a9a9a9a9a9a9","analysis_stream_size":158,"artifact_sha256":"a0a0a0a0a0a0a0a0a0a0a0a0a0a0a0a0a0a0a0a0a0a0a0a0a0a0a0a0a0a0a0a0","artifact_size":100,"manifest_sha256":"a1a1a1a1a1a1a1a1a1a1a1a1a1a1a1a1a1a1a1a1a1a1a1a1a1a1a1a1a1a1a1a1","package_format":"omarchy-zstd-tar-v1","plugin_id":"org.a-quo.oracle","plugin_version":"2.0.0"},"uncompressed_file_bytes":15}