{"archive_validation":"verified","directories":1,"entries":3,"executable_not_manifest_entry_point_paths":[],"executable_paths":["plugin/main.sh"],"files":[{"manifest_entry_point":false,"mode":420,"path":"manifest.json","sha256":"1111111111111111111111111111111111111111111111111111111111111111","size":5},{"manifest_entry_point":true,"mode":493,"path":"plugin/main.sh","sha256":"2222222222222222222222222222222222222222222222222222222222222222","size":10}],"hidden_executable_paths":[],"links":0,"manifest_entry_point_paths":["plugin/main.sh"],"omarchy_manifest_validation":"passed","regular_files":2,"schema":"urn:a-quo:omarchy-plugin-structural-evidence:v1","special_entries":0,"subject":{"analysis_stream_schema":"a-quo-regular-file-stream-v1","analysis_stream_sha256":"bbbbbbbbbbbbbbbbbbbbbbbbbbbbbbbbbbbbbbbbbbbbbbbbbbbbbbbbbbbbbbbb","analysis_stream_size":158,"artifact_sha256":"aaaaaaaaaaaaaaaaaaaaaaaaaaaaaaaaaaaaaaaaaaaaaaaaaaaaaaaaaaaaaaaa","artifact_size":100,"manifest_sha256":"1111111111111111111111111111111111111111111111111111111111111111","package_format":"omarchy-zstd-tar-v1","plugin_id":"test.risk-contract","plugin_version":"1.0.0"},"uncompressed_file_bytes":15}