{"archive_validation":"verified","directories":2,"entries":5,"executable_not_manifest_entry_point_paths":[".hidden/tool"],"executable_paths":[".hidden/tool","plugin/main.sh"],"files":[{"manifest_entry_point":false,"mode":493,"path":".hidden/tool","sha256":"b1b1b1b1b1b1b1b1b1b1b1b1b1b1b1b1b1b1b1b1b1b1b1b1b1b1b1b1b1b1b1b1","size":3},{"manifest_entry_point":false,"mode":420,"path":"manifest.json","sha256":"b2b2b2b2b2b2b2b2b2b2b2b2b2b2b2b2b2b2b2b2b2b2b2b2b2b2b2b2b2b2b2b2","size":6},{"manifest_entry_point":true,"mode":493,"path":"plugin/main.sh","sha256":"b3b3b3b3b3b3b3b3b3b3b3b3b3b3b3b3b3b3b3b3b3b3b3b3b3b3b3b3b3b3b3b3","size":11}],"hidden_executable_paths":[".hidden/tool"],"links":0,"manifest_entry_point_paths":["plugin/main.sh"],"omarchy_manifest_validation":"passed","regular_files":3,"schema":"urn:a-quo:omarchy-plugin-structural-evidence:v1","special_entries":0,"subject":{"analysis_stream_schema":"a-quo-regular-file-stream-v1","analysis_stream_sha256":"b9b9b9b9b9b9b9b9b9b9b9b9b9b9b9b9b9b9b9b9b9b9b9b9b9b9b9b9b9b9b9b9","analysis_stream_size":223,"artifact_sha256":"b0b0b0b0b0b0b0b0b0b0b0b0b0b0b0b0b0b0b0b0b0b0b0b0b0b0b0b0b0b0b0b0","artifact_size":120,"manifest_sha256":"b2b2b2b2b2b2b2b2b2b2b2b2b2b2b2b2b2b2b2b2b2b2b2b2b2b2b2b2b2b2b2b2","package_format":"omarchy-zstd-tar-v1","plugin_id":"org.a-quo.oracle","plugin_version":"2.1.0"},"uncompressed_file_bytes":20}